{
  "$schema": "./score_v2_predictive_manifest.schema.json",
  "append_only": true,
  "entries": [
    {
      "implementation_contract_sha256": "13c2b546abda5c7ba44bdf178371346062d6717c1ed7f10f6a16aac319a9f789",
      "locked_preregistration_commit_sha": "89bf56bafd594987176f31efaa926ecf02228289",
      "record_role": "predictive_origin",
      "recorded_at_utc": "2026-08-29T22:07:56.742573+00:00",
      "source_v2_attestation_run_id": 33277480141,
      "source_v2_attestation_status": "passed",
      "source_v2_bundle_sha256": "60f75ec0265d159c92e5584f425a1a881e2b4c3799bed43cb8f5bb40c188a96b",
      "source_v2_pipeline_commit_sha": "5bc1a6bb1575b7a8d9268219bb72bcdf42d974b6",
      "week": "2026-08-28",
      "weekly_record_file": "score_v2_predictive_week_2026-08-28.json",
      "weekly_record_sha256": "97891ec38541e6bc1a48269c7a71b78530c2e189e657310fef4c7777c57a1b1e"
    },
    {
      "implementation_contract_sha256": "13c2b546abda5c7ba44bdf178371346062d6717c1ed7f10f6a16aac319a9f789",
      "locked_preregistration_commit_sha": "89bf56bafd594987176f31efaa926ecf02228289",
      "record_role": "predictive_origin",
      "recorded_at_utc": "2026-09-05T18:36:11.382611+00:00",
      "source_v2_attestation_run_id": 33984532620,
      "source_v2_attestation_status": "passed",
      "source_v2_bundle_sha256": "4f20d492a749defe0123c15d4880ecbecc3285b90264e7c4807648b388ecce01",
      "source_v2_pipeline_commit_sha": "58ae75e09d9ab7abfdb896afc77cbe7fe745c6c9",
      "week": "2026-09-04",
      "weekly_record_file": "score_v2_predictive_week_2026-09-04.json",
      "weekly_record_sha256": "10c964b4505cfdc6489ac8b93619ad83e34747c04879166fa4ad62f2178d38a7"
    },
    {
      "implementation_contract_sha256": "13c2b546abda5c7ba44bdf178371346062d6717c1ed7f10f6a16aac319a9f789",
      "locked_preregistration_commit_sha": "89bf56bafd594987176f31efaa926ecf02228289",
      "record_role": "predictive_origin",
      "recorded_at_utc": "2026-09-12T01:31:56.413087+00:00",
      "source_v2_attestation_run_id": 34665051466,
      "source_v2_attestation_status": "passed",
      "source_v2_bundle_sha256": "ca33e68f3de9757e5cff7eca9be862660539d5ec51601de664227c9a4ef17fcf",
      "source_v2_pipeline_commit_sha": "babd002436dd083a54b26cd47b9c77b082c73436",
      "week": "2026-09-11",
      "weekly_record_file": "score_v2_predictive_week_2026-09-11.json",
      "weekly_record_sha256": "c0a25d1b66cc3a0a6934e3d8c5f67d87f2b2558d1a195b5259725279c7ad74d6"
    },
    {
      "implementation_contract_sha256": "13c2b546abda5c7ba44bdf178371346062d6717c1ed7f10f6a16aac319a9f789",
      "locked_preregistration_commit_sha": "89bf56bafd594987176f31efaa926ecf02228289",
      "record_role": "predictive_origin",
      "recorded_at_utc": "2026-09-19T17:37:22.553776+00:00",
      "source_v2_attestation_run_id": 35454912323,
      "source_v2_attestation_status": "passed",
      "source_v2_bundle_sha256": "27bbc0417c2632523b9de2bd0765e398ada2fccca8b7ab86596101905367d520",
      "source_v2_pipeline_commit_sha": "4f1f18a33e456af9c5acb6a97eb66f67284b51b1",
      "week": "2026-09-18",
      "weekly_record_file": "score_v2_predictive_week_2026-09-18.json",
      "weekly_record_sha256": "ea96d9f85a06d7b9dfd3af22a26c5ebb0cd256a1f400413e4a813b3ad1ff0869"
    },
    {
      "implementation_contract_sha256": "13c2b546abda5c7ba44bdf178371346062d6717c1ed7f10f6a16aac319a9f789",
      "locked_preregistration_commit_sha": "89bf56bafd594987176f31efaa926ecf02228289",
      "record_role": "predictive_origin",
      "recorded_at_utc": "2026-09-26T11:55:02.905487+00:00",
      "source_v2_attestation_run_id": 36240263528,
      "source_v2_attestation_status": "passed",
      "source_v2_bundle_sha256": "f5ac7607580d405a15ae45c608a883f7af56e05bb477a1e97aee2355311ccd83",
      "source_v2_pipeline_commit_sha": "831f48f27c03d15b454e79886635e9c9537fd482",
      "week": "2026-09-25",
      "weekly_record_file": "score_v2_predictive_week_2026-09-25.json",
      "weekly_record_sha256": "96e8a0e4b4049b82895b55d2d048395fbd5a5b787af48c5fa589187063195fb4"
    },
    {
      "implementation_contract_sha256": "13c2b546abda5c7ba44bdf178371346062d6717c1ed7f10f6a16aac319a9f789",
      "locked_preregistration_commit_sha": "89bf56bafd594987176f31efaa926ecf02228289",
      "record_role": "predictive_origin",
      "recorded_at_utc": "2026-10-03T13:21:46.865416+00:00",
      "source_v2_attestation_run_id": 37125859786,
      "source_v2_attestation_status": "passed",
      "source_v2_bundle_sha256": "9a85df9ee1a3c14b11cb463b03b2b0c8d0bd0559fd929efbfd18e906a63c9ac0",
      "source_v2_pipeline_commit_sha": "05df45d423db48f86d05744b19f663124ba10964",
      "week": "2026-10-02",
      "weekly_record_file": "score_v2_predictive_week_2026-10-02.json",
      "weekly_record_sha256": "b5446ef095cee386bd3525e5746bd6fa4f11224be69e51cdd4f5f2d88807b5fe"
    },
    {
      "implementation_contract_sha256": "13c2b546abda5c7ba44bdf178371346062d6717c1ed7f10f6a16aac319a9f789",
      "locked_preregistration_commit_sha": "89bf56bafd594987176f31efaa926ecf02228289",
      "record_role": "predictive_origin",
      "recorded_at_utc": "2026-10-10T12:11:16.636245+00:00",
      "source_v2_attestation_run_id": 38050960268,
      "source_v2_attestation_status": "passed",
      "source_v2_bundle_sha256": "7ac594d4ed7df544ea41944fa80208bdf936b8b1b865048636ba1a5ded30c60d",
      "source_v2_pipeline_commit_sha": "aed97276b0fd1f36135c5ab3f78718458d67c934",
      "week": "2026-10-09",
      "weekly_record_file": "score_v2_predictive_week_2026-10-09.json",
      "weekly_record_sha256": "b5c13b6a99f41b43bec36f03bee8cbe81ee2d1f62b71ebbad0f37eb201050a89"
    },
    {
      "implementation_contract_sha256": "13c2b546abda5c7ba44bdf178371346062d6717c1ed7f10f6a16aac319a9f789",
      "locked_preregistration_commit_sha": "89bf56bafd594987176f31efaa926ecf02228289",
      "record_role": "predictive_origin",
      "recorded_at_utc": "2026-10-17T10:45:24.050729+00:00",
      "source_v2_attestation_run_id": 39026016627,
      "source_v2_attestation_status": "passed",
      "source_v2_bundle_sha256": "82458aaf73fb5a82fec5b68498e71b03c758cf15be2f58a58df17b3468403628",
      "source_v2_pipeline_commit_sha": "0be6a771e984a09b4ca1793c762f296a7d4dc2ca",
      "week": "2026-10-16",
      "weekly_record_file": "score_v2_predictive_week_2026-10-16.json",
      "weekly_record_sha256": "3e15fa0a2f27e6a415e2bab7ab6412a7f1e1123b658a51a3c2bf7a0b5bacef74"
    },
    {
      "implementation_contract_sha256": "13c2b546abda5c7ba44bdf178371346062d6717c1ed7f10f6a16aac319a9f789",
      "locked_preregistration_commit_sha": "89bf56bafd594987176f31efaa926ecf02228289",
      "record_role": "predictive_origin",
      "recorded_at_utc": "2026-10-26T15:54:17.078910+00:00",
      "source_v2_attestation_run_id": 40353643660,
      "source_v2_attestation_status": "passed",
      "source_v2_bundle_sha256": "b0c8dfd79ff9a01fb645479f337c72b0e9133f081a4dca284999dc6267d9cb40",
      "source_v2_pipeline_commit_sha": "1bdd9a47796876e794bb6a24248ced8823f8b719",
      "week": "2026-10-23",
      "weekly_record_file": "score_v2_predictive_week_2026-10-23.json",
      "weekly_record_sha256": "8b1942fc8d860c02f1b02d390618341bc457573e4d6da0a5770766ac9ef64633"
    }
  ],
  "first_prediction_origin": "2026-08-28",
  "implementation_contract_sha256": "13c2b546abda5c7ba44bdf178371346062d6717c1ed7f10f6a16aac319a9f789",
  "interim_integrity_checkpoints": [
    13,
    26,
    39
  ],
  "locked_preregistration_commit_sha": "89bf56bafd594987176f31efaa926ecf02228289",
  "locked_preregistration_file_sha256": "36accc42e4915bb48caa1c4d2fd0fac8ba27c51c0eb988916990c415830e3ca0",
  "manifest_version": 1,
  "predictive_power_status": "not_established_pending_52_resolved_predictions",
  "production_change": false,
  "required_predictive_origins": 52,
  "required_weekly_observations": 53,
  "research_only": true,
  "study": "usd_impact_score_v2_one_week_dxy_direction_2026-08-25"
}
